{
  "summary": {
    "roles": 6,
    "permissionAreas": 12,
    "fieldRules": 8,
    "approvalRules": 7
  },
  "roles": [
    {
      "name": "Administrator",
      "template": "Full agency control",
      "scope": "All agency",
      "badges": [
        "View all",
        "Edit all",
        "Approve all",
        "Override",
        "Export"
      ],
      "notes": "Agency owner/admin role with final control over policy and permissions."
    },
    {
      "name": "Supervisor",
      "template": "Managed-scope control",
      "scope": "Supervised employees from v2.15 hierarchy",
      "badges": [
        "View supervised",
        "Approve requests",
        "Edit limited fields",
        "Review audit"
      ],
      "notes": "Access is limited by assigned employees, groups, positions, departments, divisions, or locations."
    },
    {
      "name": "Employee",
      "template": "Self-service access",
      "scope": "Own record only",
      "badges": [
        "View own",
        "Request changes",
        "Edit allowed fields",
        "Notification prefs"
      ],
      "notes": "Employee access depends on agency field-level policy."
    },
    {
      "name": "Training Officer",
      "template": "Training/cert authority",
      "scope": "Agency-defined",
      "badges": [
        "View certifications",
        "Edit training",
        "Approve training"
      ],
      "notes": "Future custom role for credential and certification workflows."
    },
    {
      "name": "Payroll/HR",
      "template": "Benefits and export",
      "scope": "Agency-defined",
      "badges": [
        "View balances",
        "Adjust ledger",
        "Export records"
      ],
      "notes": "Future custom role for HR/payroll functions."
    },
    {
      "name": "Viewer",
      "template": "Read-only",
      "scope": "Agency-defined",
      "badges": [
        "View only",
        "No edits",
        "No approvals"
      ],
      "notes": "For command staff or support users who need visibility without modification rights."
    }
  ],
  "permissionMatrix": [
    {
      "area": "Employee Profile",
      "employee": "View own / edit allowed fields",
      "supervisor": "View supervised / request edits",
      "admin": "Full edit / lock fields"
    },
    {
      "area": "Schedule Assignments",
      "employee": "View own",
      "supervisor": "View or edit supervised if allowed",
      "admin": "Full assignment control"
    },
    {
      "area": "Leave Requests",
      "employee": "Create own",
      "supervisor": "Approve supervised if allowed",
      "admin": "Approve / override / audit"
    },
    {
      "area": "Trades & Swaps",
      "employee": "Request/accept own",
      "supervisor": "Approve supervised trades",
      "admin": "Full override"
    },
    {
      "area": "Open Shifts / VOT",
      "employee": "Volunteer if eligible",
      "supervisor": "Award within scope",
      "admin": "Post/award/override"
    },
    {
      "area": "Training & Certifications",
      "employee": "View own",
      "supervisor": "View/edit supervised if allowed",
      "admin": "Full credential control"
    },
    {
      "area": "Benefit Ledger",
      "employee": "View own balances",
      "supervisor": "View supervised if allowed",
      "admin": "Adjust and audit"
    },
    {
      "area": "Timeline & Audit",
      "employee": "View own limited history",
      "supervisor": "View supervised history",
      "admin": "Full agency audit"
    }
  ],
  "fieldRules": [
    {
      "field": "Work Email",
      "employee": "View only",
      "supervisor": "View only",
      "admin": "Edit / cannot remove required agency email",
      "approval": "Admin only"
    },
    {
      "field": "Personal Email",
      "employee": "Add/Edit",
      "supervisor": "View",
      "admin": "Edit",
      "approval": "Optional agency policy"
    },
    {
      "field": "Cell Phone",
      "employee": "Edit if allowed",
      "supervisor": "View",
      "admin": "Edit",
      "approval": "May require approval"
    },
    {
      "field": "Notification Preferences",
      "employee": "Edit allowed channels",
      "supervisor": "View summary",
      "admin": "Set allowed channels",
      "approval": "No approval unless agency requires"
    },
    {
      "field": "Certifications",
      "employee": "View",
      "supervisor": "Edit if training role permits",
      "admin": "Full edit",
      "approval": "Audit required"
    },
    {
      "field": "Benefit Balances",
      "employee": "View",
      "supervisor": "View if allowed",
      "admin": "Adjust",
      "approval": "Reason required"
    }
  ],
  "scopeRules": [
    {
      "title": "Own Record",
      "description": "Employee can only see or change fields attached to their own profile."
    },
    {
      "title": "Supervised Scope",
      "description": "Supervisor access is limited to the effective employees returned by the v2.15 hierarchy engine."
    },
    {
      "title": "Department / Group Scope",
      "description": "Custom roles can be scoped to a shift group, department, position, division, or location."
    },
    {
      "title": "Agency Scope",
      "description": "Administrators can see the entire agency unless a higher-level enterprise rule later limits them."
    }
  ],
  "approvalRules": [
    {
      "workflow": "Leave Request",
      "employee": "Submit",
      "supervisor": "Approve within scope",
      "admin": "Override / final approval"
    },
    {
      "workflow": "Profile Change",
      "employee": "Request or edit allowed field",
      "supervisor": "Review if configured",
      "admin": "Approve locked-field changes"
    },
    {
      "workflow": "Trade Request",
      "employee": "Submit/accept",
      "supervisor": "Approve if coverage/eligibility passes",
      "admin": "Override with reason"
    },
    {
      "workflow": "Benefit Adjustment",
      "employee": "View/request correction",
      "supervisor": "Recommend",
      "admin": "Adjust with audit reason"
    }
  ],
  "notes": [
    "Roles are starting templates; agency policy determines final permissions.",
    "Permissions are action-based: view, create, edit, approve, deny, delete, override, export.",
    "Effective permission previews combine role, scope, field rules, and approval rules.",
    "v2.17 will use these rules to power the request approval workflow."
  ]
}